{
  "id": "tokens_top",
  "version": 2,
  "source": "rainbow",
  "type": "token",
  "updatedAt": "2026-05-15T15:59:08.900Z",
  "items": [
    {
      "id": "eth:1"
    },
    {
      "id": "0xa53887f7e7c1bf5010b8627f1c1ba94fe7a5d6e0:8453"
    },
    {
      "id": "0x2260fac5e5542a773aa44fbcfedf7c193bc2c599:1"
    },
    {
      "id": "0x1f9840a85d5aF5bf1D1762F925BDADdC4201F984:1"
    },
    {
      "id": "0x4200000000000000000000000000000000000042:10"
    }
  ]
}
